{
  "version": "0.1.0",
  "lastUpdate": "2026-09-15T00:00:00.000Z",
  "count": 32,
  "source": "https://observatorioia.org",
  "license": "CC BY 4.0",
  "data": [
    {
      "id": "pj-clasificacion-cobros",
      "titulo": {
        "es": "Tipificador de Escritos",
        "en": "Filing Classifier"
      },
      "institucionId": "poder-judicial",
      "categoria": "judicial",
      "estado": "operativo",
      "desde": "2020",
      "descripcion": {
        "es": "Sistema de inteligencia artificial del Poder Judicial que usa aprendizaje automático y reconocimiento óptico de caracteres para leer y clasificar automáticamente los escritos presentados en los juzgados especializados de cobro judicial. La institución documenta su implantación en toda la jurisdicción cobratoria.",
        "en": "Judicial Branch AI system that uses machine learning and optical character recognition to read and automatically classify filings submitted to specialized debt collection courts. The institution documents its deployment across the entire debt collection jurisdiction."
      },
      "resultado": {
        "es": "Entre el 1 de enero y el 29 de noviembre de 2024 procesó 1.302.899 escritos, según el Poder Judicial. La institución vincula su uso estandarizado con mejores tiempos de respuesta, pero la fuente no aísla el efecto causal del Tipificador frente a otras medidas de gestión.",
        "en": "According to the Judicial Branch, it processed 1,302,899 filings from January 1 through November 29, 2024. The institution links its standardized use to improved response times, but the source does not isolate the Classifier's causal effect from other management measures."
      },
      "contexto": {
        "es": "El piloto comenzó en Pérez Zeledón en marzo de 2020; el Consejo Superior aprobó la expansión en diciembre de 2022 y una fuente institucional confirmó operación nacional en 2024. La Circular 241-2025 exige retroalimentar el sistema y mantener la clasificación manual cuando corresponda. En 2026, el Poder Judicial documentó dentro de SIGMA una mejora denominada Depurador de Escritos; esto no implica que todo el Tipificador esté alojado en SIGMA.",
        "en": "The pilot began in Pérez Zeledón in March 2020; the Superior Council approved expansion in December 2022, and an institutional source confirmed nationwide operation in 2024. Circular 241-2025 requires feedback to the system and manual classification when needed. In 2026, the Judicial Branch documented an enhancement called Depurador de Escritos within SIGMA; this does not imply that the entire Classifier is hosted in SIGMA."
      },
      "fuenteUrl": "https://pj.poder-judicial.go.cr/index.php/component/content/article/760-poder-judicial-implementa-inteligencia-artificial-para-disminuir-circulante-en-materia-cobratoria",
      "modeloVersion": 2,
      "tipoIniciativa": "sistema-ia",
      "estadoCatalogo": "verificado",
      "faseImplementacion": "operativo",
      "estadoIA": "confirmada",
      "evaluacion": {
        "existencia": {
          "estado": "confirmado",
          "fuenteIds": [
            "pj-tipificador-expansion-2023",
            "pj-tipificador-operacion-2024"
          ]
        },
        "ejecucion": {
          "estado": "confirmado",
          "fuenteIds": [
            "pj-tipificador-operacion-2024",
            "pj-tipificador-boletin-165-2026"
          ]
        },
        "tecnicaIA": {
          "estado": "confirmado",
          "fuenteIds": [
            "pj-tipificador-expansion-2023",
            "pj-tipificador-premio-2023"
          ]
        },
        "usoOperativo": {
          "estado": "confirmado",
          "fuenteIds": [
            "pj-tipificador-operacion-2024",
            "pj-tipificador-circular-241-2025",
            "pj-tipificador-boletin-165-2026"
          ]
        },
        "resultados": {
          "estado": "confirmado",
          "fuenteIds": [
            "pj-tipificador-premio-2023",
            "pj-tipificador-operacion-2024"
          ]
        },
        "gobernanza": {
          "estado": "parcialmente-confirmado",
          "fuenteIds": [
            "pj-tipificador-expansion-2023",
            "pj-tipificador-circular-241-2025"
          ]
        }
      },
      "fuentes": [
        {
          "id": "pj-clasificador-oficial",
          "url": "https://pj.poder-judicial.go.cr/index.php/component/content/article/760-poder-judicial-implementa-inteligencia-artificial-para-disminuir-circulante-en-materia-cobratoria",
          "publicador": "Poder Judicial de Costa Rica",
          "tipoFuente": "primaria-oficial",
          "respalda": [
            "existencia",
            "objetivo-declarado",
            "ejecucion",
            "tecnica-ia",
            "uso-operativo",
            "resultado-reportado"
          ],
          "naturalezaAfirmacion": [
            "hecho",
            "resultado-reportado"
          ],
          "titulo": {
            "es": "Poder Judicial implementa inteligencia artificial para disminuir circulante en materia cobratoria",
            "en": "Judicial Branch implements artificial intelligence to reduce the debt-collection caseload"
          },
          "fechaConsulta": "2026-09-08"
        },
        {
          "id": "pj-tipificador-expansion-2023",
          "url": "https://actualidadjudicial.poder-judicial.go.cr/vol285/index.html",
          "publicador": "Poder Judicial de Costa Rica",
          "tipoFuente": "primaria-oficial",
          "fechaPublicacion": "2023-05-10",
          "respalda": [
            "existencia",
            "objetivo-declarado",
            "ejecucion",
            "tecnica-ia",
            "uso-operativo",
            "resultado-reportado",
            "gobernanza"
          ],
          "naturalezaAfirmacion": [
            "hecho",
            "resultado-reportado"
          ],
          "titulo": {
            "es": "Poder Judicial abre camino a la Inteligencia Artificial en sus despachos de cobro judicial",
            "en": "Judicial Branch advances artificial intelligence in its debt collection courts"
          },
          "fechaConsulta": "2026-09-08"
        },
        {
          "id": "pj-tipificador-premio-2023",
          "url": "https://pj.poder-judicial.go.cr/index.php/component/content/article/1044-en-xxi-asamblea-plenaria-de-la-cumbre-judicial-iberoamericana-poder-judicial-recibe-distincion-internacional-por-avances-tecnologicos-y-compromiso-de-genero?Itemid=409&catid=8",
          "publicador": "Poder Judicial de Costa Rica",
          "tipoFuente": "primaria-oficial",
          "fechaPublicacion": "2023",
          "respalda": [
            "existencia",
            "tecnica-ia",
            "resultado-reportado"
          ],
          "naturalezaAfirmacion": [
            "hecho",
            "resultado-reportado"
          ],
          "titulo": {
            "es": "Poder Judicial recibe distinción internacional por avances tecnológicos y compromiso de género",
            "en": "Judicial Branch receives international recognition for technological progress and gender commitment"
          },
          "fechaConsulta": "2026-09-08"
        },
        {
          "id": "pj-tipificador-operacion-2024",
          "url": "https://actualidadjudicial.poder-judicial.go.cr/vol294/noticias_judiciales/nj4-294.html",
          "publicador": "Poder Judicial de Costa Rica",
          "tipoFuente": "primaria-oficial",
          "fechaPublicacion": "2025",
          "respalda": [
            "existencia",
            "ejecucion",
            "uso-operativo",
            "resultado-reportado"
          ],
          "naturalezaAfirmacion": [
            "hecho",
            "resultado-reportado"
          ],
          "titulo": {
            "es": "Juzgados de Cobro Judicial alcanzan en 2024 el circulante más bajo en los últimos cuatro años",
            "en": "Debt collection courts reach their lowest caseload in four years in 2024"
          },
          "fechaConsulta": "2026-09-08"
        },
        {
          "id": "pj-tipificador-circular-241-2025",
          "url": "https://nexuspj.poder-judicial.go.cr/document/avi-1-0003-14292",
          "publicador": "Poder Judicial de Costa Rica",
          "tipoFuente": "primaria-oficial",
          "fechaPublicacion": "2026-01-07",
          "respalda": [
            "ejecucion",
            "uso-operativo",
            "gobernanza"
          ],
          "naturalezaAfirmacion": [
            "hecho"
          ],
          "titulo": {
            "es": "Circular 241-2025: obligatoriedad de retroalimentar al sistema de inteligencia artificial Tipificador de Escritos",
            "en": "Circular 241-2025: mandatory feedback for the Filing Classifier artificial intelligence system"
          },
          "fechaConsulta": "2026-09-08"
        },
        {
          "id": "pj-tipificador-boletin-165-2026",
          "url": "https://nexuspj.poder-judicial.go.cr/document/avi-1-0155-15756",
          "publicador": "Poder Judicial de Costa Rica",
          "tipoFuente": "primaria-oficial",
          "fechaPublicacion": "2026-09-02",
          "respalda": [
            "ejecucion",
            "uso-operativo",
            "gobernanza"
          ],
          "naturalezaAfirmacion": [
            "hecho"
          ],
          "titulo": {
            "es": "Boletín Judicial 165-2026: uso del Depurador de Escritos asociado al Tipificador",
            "en": "Judicial Bulletin 165-2026: use of Depurador de Escritos associated with the Classifier"
          },
          "fechaConsulta": "2026-09-08"
        }
      ],
      "fechaPrimeraEvidencia": "2020-03",
      "fechaInicioPiloto": "2020-03",
      "fechaUltimaVerificacion": "2026-09-08",
      "fechaProximaRevision": "2026-12-08",
      "objetivoDeclarado": {